{
  "shoulder_pan": {
    "id": 1,
    "drive_mode": 0,
    "homing_offset": -18,
    "range_min": 810,
    "range_max": 3280
  },
  "shoulder_lift": {
    "id": 2,
    "drive_mode": 0,
    "homing_offset": 34,
    "range_min": 870,
    "range_max": 3180
  },
  "elbow_flex": {
    "id": 3,
    "drive_mode": 0,
    "homing_offset": -11,
    "range_min": 900,
    "range_max": 3125
  },
  "wrist_flex": {
    "id": 4,
    "drive_mode": 0,
    "homing_offset": 22,
    "range_min": 920,
    "range_max": 3090
  },
  "wrist_roll": {
    "id": 5,
    "drive_mode": 0,
    "homing_offset": 3,
    "range_min": 230,
    "range_max": 3880
  },
  "gripper": {
    "id": 6,
    "drive_mode": 0,
    "homing_offset": 15,
    "range_min": 1430,
    "range_max": 2680
  }
}
